{
  "artifact": "tiingo_free_account_acceptance",
  "authenticated_endpoints": {
    "metadata_QLD": {
      "access": "PASS",
      "end_date": "2026-10-01",
      "exchange_code": "NYSE",
      "http_status": 200,
      "name": "PROSHARES ULTRA QQQ ",
      "raw_archive_reconstruction": "PASS",
      "raw_byte_length": 4471,
      "raw_filename": "metadata_QLD.raw",
      "raw_sha256": "1c45baefd673b33c18131fbb38a0e10143f28fef197ef78853732b5c8fbd775e",
      "safe_headers": {"content-type": "application/json", "date": "Fri, 02 Oct 2026 14:03:32 GMT"},
      "start_date": "2006-06-21",
      "ticker": "QLD"
    },
    "metadata_QQQ": {
      "access": "PASS",
      "end_date": "2026-10-01",
      "exchange_code": "NASDAQ",
      "http_status": 200,
      "name": "Invesco QQQ Trust Series 1",
      "raw_archive_reconstruction": "PASS",
      "raw_byte_length": 625,
      "raw_filename": "metadata_QQQ.raw",
      "raw_sha256": "78021f0e427c6ce1d1f9ab7c552c19ec371a83a85218d65797f166069ab5600c",
      "safe_headers": {"content-type": "application/json", "date": "Fri, 02 Oct 2026 14:03:30 GMT"},
      "start_date": "1999-03-10",
      "ticker": "QQQ"
    },
    "prices_QLD": {
      "access": "PASS",
      "field_semantics": ["date", "open", "high", "low", "close", "volume", "adjOpen", "adjHigh", "adjLow", "adjClose", "adjVolume", "divCash", "splitFactor"],
      "first_date": "2025-01-02",
      "http_status": 200,
      "last_date": "2026-10-01",
      "raw_archive_reconstruction": "PASS",
      "raw_byte_length": 111241,
      "raw_filename": "prices_QLD.raw",
      "raw_sha256": "8b2200f43e71e1c722042c9d05d35d074c214bae2b10710eddfb0e41fe424a18",
      "required_field_null_count": 0,
      "row_count": 438,
      "safe_headers": {"content-type": "application/json", "date": "Fri, 02 Oct 2026 14:03:38 GMT"},
      "unique_session_count": 438
    },
    "prices_QQQ": {
      "access": "PASS",
      "field_semantics": ["date", "open", "high", "low", "close", "volume", "adjOpen", "adjHigh", "adjLow", "adjClose", "adjVolume", "divCash", "splitFactor"],
      "first_date": "2025-01-02",
      "http_status": 200,
      "last_date": "2026-10-01",
      "raw_archive_reconstruction": "PASS",
      "raw_byte_length": 114766,
      "raw_filename": "prices_QQQ.raw",
      "raw_sha256": "9f403065974f7a6693214107af2fca00aa2c7cba3d8dccffa2365a1e413c4076",
      "required_field_null_count": 0,
      "row_count": 438,
      "safe_headers": {"content-type": "application/json", "date": "Fri, 02 Oct 2026 14:03:31 GMT"},
      "unique_session_count": 438
    }
  },
  "credential_present": true,
  "credential_value_stored": false,
  "end_date": "2026-10-01",
  "engine_or_scheduler_started": false,
  "failure_reason": null,
  "final_gate": "SOURCE_ACCEPTANCE_PENDING_OPERATIONAL_LATENCY_EVIDENCE",
  "historical_performance_calculated": false,
  "official_observation_created": false,
  "publication_latency_observation_completed": false,
  "raw_archive_mode": "700",
  "raw_bytes_archived_before_parse": true,
  "schema_version": "1.0",
  "signal_calculated": false,
  "source_promoted": false,
  "start_date": "2025-01-01",
  "symbols": ["QQQ", "QLD"]
}
